<?xml version="1.0"?>
<rmmt-api xmlns="http://dev.rendsmoimatune.eu/api"
	xmlns:xsi="http://www.w3.org/2001/XMLSchema-instance"
	xsi:schemaLocation="http://dev.rendsmoimatune.eu/api/rmmt.xsd"
	version="1.0"
	encoding="UTF-8">

	<account id="3" title="Pulp fiction">
		<users>
			<user id="1" name="Paul Fariello"/>
			<user id="2" name="Jules Winnfield"/>
			<user id="3" name="Vincent Vega"/>
		</users>
		<expenditures>
			<expenditure id="1" title="Big kahuna burger" amount="2000"/>
			<expenditure id="2" title="Clothes" amount="100000"/>
			<expenditure id="3" title="Beers" amount="1000"/>
		</expenditures>
		<repayments>
			<repayment id="1" from="3" to="1" amount="10000"/>
		</repayments>
	</account>

</rmmt-api>
